{
  "id": "academic-sample-01",
  "schemaVersion": 1,
  "module": "academic",
  "title": "Rooftop Farming Returns to the City",
  "timeLimitMinutes": 20,
  "passages": [
    {
      "id": "p1",
      "title": "Rooftop Farming Returns to the City",
      "paragraphs": [
        {
          "label": "A",
          "text": "In the early twentieth century, many European cities kept small vegetable plots on flat roofs, but the practice faded after cheap refrigerated transport made it easier to bring produce from distant farms. By the 1970s, rooftops were seen mainly as places for water tanks and ventilation equipment."
        },
        {
          "label": "B",
          "text": "Interest returned in the 2000s, driven less by food security than by concerns about heat. Dark roofs absorb sunlight during the day and release it at night, raising neighbourhood temperatures. Researchers in Montreal recorded surface temperatures on a planted roof that were up to 30 degrees Celsius lower than on a nearby bitumen roof during a summer afternoon."
        },
        {
          "label": "C",
          "text": "The weight of soil remains the main engineering obstacle. Saturated soil can be extremely heavy, so most commercial rooftop farms now use lightweight growing media made from expanded clay or recycled materials. Some operators avoid soil entirely and rely on hydroponic systems, in which plant roots sit in nutrient-rich water."
        },
        {
          "label": "D",
          "text": "Economic results are mixed. A farm in Brooklyn that opened in 2010 reported that restaurant contracts, rather than sales at local markets, provided most of its income in its first five years. However, a survey of 42 rooftop projects in North America found that fewer than a third covered their operating costs from food sales alone; many relied on educational programmes or corporate events."
        },
        {
          "label": "E",
          "text": "City governments have begun to respond. Several have changed building regulations so that a roof garden no longer counts towards a building's height limit, and a few offer tax reductions to owners who install vegetation. Critics argue that such incentives mainly benefit wealthy developers, yet supporters point out that cooler streets help all residents, especially elderly people during heatwaves."
        }
      ],
      "questionGroups": [
        {
          "id": "g1",
          "type": "true_false_not_given",
          "instruction": "Do the following statements agree with the information given in the passage? Write TRUE if the statement agrees with the information, FALSE if the statement contradicts the information, NOT GIVEN if there is no information on this.",
          "questions": [
            {
              "id": "q1",
              "number": 1,
              "prompt": "Rooftop vegetable growing declined partly because of improvements in transporting food.",
              "acceptedAnswers": ["TRUE"],
              "explanation": {
                "text": "Đoạn A nói việc trồng rau trên mái nhà mai một sau khi vận chuyển đông lạnh giá rẻ giúp đưa nông sản từ các trang trại xa về dễ hơn, nên cải tiến trong vận chuyển thực phẩm đúng là một nguyên nhân.",
                "evidence": {
                  "type": "passage",
                  "paragraphId": "A",
                  "quote": "the practice faded after cheap refrigerated transport made it easier to bring produce from distant farms"
                },
                "paraphrases": [
                  { "inQuestion": "declined", "inSource": "faded" },
                  { "inQuestion": "improvements in transporting food", "inSource": "cheap refrigerated transport" }
                ],
                "trap": "Chữ 'partly' khiến nhiều bạn chọn NOT GIVEN, nhưng bài chỉ cần nêu đây là một nguyên nhân là đủ để câu đúng."
              }
            },
            {
              "id": "q2",
              "number": 2,
              "prompt": "The revival of rooftop farming in the 2000s was mainly motivated by food shortages.",
              "acceptedAnswers": ["FALSE"],
              "explanation": {
                "text": "Đoạn B cho biết sự quan tâm quay lại chủ yếu vì lo ngại nhiệt độ chứ không phải vì an ninh lương thực, nên câu 'chủ yếu do thiếu lương thực' mâu thuẫn với bài.",
                "evidence": {
                  "type": "passage",
                  "paragraphId": "B",
                  "quote": "Interest returned in the 2000s, driven less by food security than by concerns about heat."
                },
                "paraphrases": [
                  { "inQuestion": "revival", "inSource": "Interest returned" },
                  { "inQuestion": "food shortages", "inSource": "food security" }
                ],
                "trap": "Cụm 'food security' đứng ngay cạnh 'the 2000s' nên dễ chọn TRUE; cấu trúc 'less by ... than by ...' cho biết đó chỉ là lý do phụ."
              }
            },
            {
              "id": "q3",
              "number": 3,
              "prompt": "The Montreal study was carried out over several years.",
              "acceptedAnswers": ["NOT GIVEN"],
              "explanation": {
                "text": "Đoạn B chỉ nói các nhà nghiên cứu ở Montreal đo nhiệt độ bề mặt vào một buổi chiều mùa hè; bài không cho biết nghiên cứu kéo dài bao lâu.",
                "evidence": {
                  "type": "passage",
                  "paragraphId": "B",
                  "quote": "Researchers in Montreal recorded surface temperatures on a planted roof"
                },
                "paraphrases": [
                  { "inQuestion": "The Montreal study", "inSource": "Researchers in Montreal recorded" }
                ],
                "trap": "'a summer afternoon' dễ khiến bạn chọn FALSE, nhưng đó là thời điểm đo, không phải thời gian của cả nghiên cứu."
              }
            },
            {
              "id": "q4",
              "number": 4,
              "prompt": "Most commercial rooftop farms today grow plants in ordinary garden soil.",
              "acceptedAnswers": ["FALSE"],
              "explanation": {
                "text": "Đoạn C nói phần lớn trang trại thương mại hiện dùng giá thể nhẹ thay cho đất vì đất ngấm nước rất nặng, trái ngược với câu hỏi.",
                "evidence": {
                  "type": "passage",
                  "paragraphId": "C",
                  "quote": "most commercial rooftop farms now use lightweight growing media made from expanded clay or recycled materials"
                },
                "paraphrases": [
                  { "inQuestion": "today", "inSource": "now" }
                ],
                "trap": "Đoạn C mở đầu bằng 'The weight of soil', nên đọc lướt dễ tưởng các trang trại vẫn trồng bằng đất."
              }
            },
            {
              "id": "q5",
              "number": 5,
              "prompt": "Hydroponic systems are more expensive to run than soil-based systems.",
              "acceptedAnswers": ["NOT GIVEN"],
              "explanation": {
                "text": "Đoạn C mô tả hệ thống thuỷ canh nhưng không so sánh chi phí vận hành của nó với trồng bằng đất.",
                "evidence": {
                  "type": "passage",
                  "paragraphId": "C",
                  "quote": "Some operators avoid soil entirely and rely on hydroponic systems, in which plant roots sit in nutrient-rich water."
                },
                "trap": "Đoạn D có nhắc 'operating costs', nhưng đó là chi phí của các dự án nói chung, không phải so sánh thuỷ canh với đất."
              }
            }
          ]
        },
        {
          "id": "g2",
          "type": "multiple_choice",
          "instruction": "Choose the correct letter, A, B, C or D.",
          "questions": [
            {
              "id": "q6",
              "number": 6,
              "prompt": "According to paragraph D, the Brooklyn farm earned most of its early income from",
              "options": [
                { "key": "A", "text": "sales at local markets." },
                { "key": "B", "text": "agreements with restaurants." },
                { "key": "C", "text": "educational programmes." },
                { "key": "D", "text": "corporate events." }
              ],
              "acceptedAnswers": ["B"],
              "explanation": {
                "text": "Đoạn D: hợp đồng với nhà hàng, chứ không phải bán hàng ở chợ, mang lại phần lớn thu nhập trong năm năm đầu.",
                "evidence": {
                  "type": "passage",
                  "paragraphId": "D",
                  "quote": "restaurant contracts, rather than sales at local markets, provided most of its income in its first five years"
                },
                "paraphrases": [
                  { "inQuestion": "agreements with restaurants", "inSource": "restaurant contracts" },
                  { "inQuestion": "early income", "inSource": "income in its first five years" }
                ],
                "trap": "Phương án A dùng đúng cụm 'sales at local markets' của bài, nhưng bài đã loại nó bằng 'rather than'."
              }
            },
            {
              "id": "q7",
              "number": 7,
              "prompt": "The survey of 42 rooftop projects found that",
              "options": [
                { "key": "A", "text": "most projects made a profit from food." },
                { "key": "B", "text": "fewer than a third paid their running costs through food sales alone." },
                { "key": "C", "text": "educational programmes lost money." },
                { "key": "D", "text": "projects in Canada performed better than those in the United States." }
              ],
              "acceptedAnswers": ["B"],
              "explanation": {
                "text": "Đoạn D: chưa đến một phần ba số dự án trang trải được chi phí vận hành chỉ bằng việc bán thực phẩm.",